{
  "atomic_unit_id": "AU-DU12-02",
  "workset_id": "WS-S0.1-A",
  "title": "get（store.py）",
  "status": "planned",
  "api_ids": [
    "API-DU12-02"
  ],
  "clause_ids": [
    "API-DU12-02-POST-01",
    "API-DU12-02-POST-02",
    "API-DU12-02-PRE-01",
    "API-DU12-02-RAISE-01"
  ],
  "implementation_unit_ids": [
    "IU-CONFIGSTORE-01"
  ],
  "ut_nodeids": [
    "tests/unit/test_config_store.py::test_get_missing_key_returns_default_when_given",
    "tests/unit/test_config_store.py::test_get_missing_key_without_default_fail_close",
    "tests/unit/test_config_store.py::test_get_returns_latest_row_type_converted"
  ],
  "modules": [
    "src/helix/config/store.py"
  ],
  "depends_on_atomic_units": [
    "AU-DU10-01"
  ],
  "coverage_floor": 80,
  "merge_reason": null,
  "workset_itc_ids": [
    "ITC-01",
    "ITC-04"
  ],
  "itc_evidence": null,
  "red_receipt": null,
  "green_receipt": null
}
