{
  "atomic_unit_id": "AU-DU05-02",
  "workset_id": "WS-S0.1-B",
  "title": "revoke_if_changed（pair.py）",
  "status": "planned",
  "api_ids": [
    "API-DU05-02"
  ],
  "clause_ids": [
    "API-DU05-02-POST-01",
    "API-DU05-02-POST-02",
    "API-DU05-02-PRE-01"
  ],
  "implementation_unit_ids": [
    "IU-PAIRGATE-03"
  ],
  "ut_nodeids": [
    "tests/unit/test_gates_pair.py::test_require_pair_missing_or_revoked_rejected",
    "tests/unit/test_gates_pair.py::test_revoke_if_changed_revokes_on_commit_change"
  ],
  "modules": [
    "src/helix/gates/pair.py"
  ],
  "depends_on_atomic_units": [
    "AU-DU09-02",
    "AU-DU09-03"
  ],
  "coverage_floor": 80,
  "merge_reason": null,
  "workset_itc_ids": [],
  "itc_evidence": null,
  "red_receipt": null,
  "green_receipt": null
}
