{
  "atomic_unit_id": "AU-DU02-09",
  "workset_id": "WS-S0.1-C",
  "title": "get_tactical_learning_packet（orchestrator.py）",
  "status": "planned",
  "api_ids": [
    "API-DU02-09"
  ],
  "clause_ids": [
    "API-DU02-09-POST-01",
    "API-DU02-09-PRE-01"
  ],
  "implementation_unit_ids": [],
  "ut_nodeids": [
    "tests/unit/test_kernel_orchestrator.py::test_get_tactical_learning_packet_returns_record_or_none"
  ],
  "modules": [
    "src/helix/kernel/orchestrator.py"
  ],
  "depends_on_atomic_units": [
    "AU-DU01-02",
    "AU-DU04-01",
    "AU-DU04-02",
    "AU-DU08-01",
    "AU-DU09-01",
    "AU-DU10-01",
    "AU-DU12-02"
  ],
  "coverage_floor": 80,
  "merge_reason": null,
  "workset_itc_ids": [],
  "itc_evidence": null,
  "red_receipt": null,
  "green_receipt": null
}
