{
  "atomic_unit_id": "AU-DU06-01",
  "workset_id": "WS-S0.1-B",
  "title": "check_publishable（publish.py）",
  "status": "planned",
  "api_ids": [
    "API-DU06-01"
  ],
  "clause_ids": [
    "API-DU06-01-POST-01",
    "API-DU06-01-POST-02",
    "API-DU06-01-PRE-01",
    "API-DU06-01-PRE-02",
    "API-DU06-01-RAISE-01",
    "API-DU06-01-RAISE-02",
    "API-DU06-01-RAISE-03"
  ],
  "implementation_unit_ids": [
    "IU-PAIRGATE-04"
  ],
  "ut_nodeids": [
    "tests/unit/test_gates_publish.py::test_check_publishable_all_conditions_returns_pairpass",
    "tests/unit/test_gates_publish.py::test_check_publishable_hash_mismatch_rejected",
    "tests/unit/test_gates_publish.py::test_check_publishable_missing_evidence_rejected",
    "tests/unit/test_gates_publish.py::test_check_publishable_rejection_precedes_connector_call",
    "tests/unit/test_gates_publish.py::test_check_publishable_without_pair_rejected"
  ],
  "modules": [
    "src/helix/gates/publish.py"
  ],
  "depends_on_atomic_units": [
    "AU-DU05-03",
    "AU-DU09-02",
    "AU-DU09-03",
    "AU-DU10-01"
  ],
  "coverage_floor": 80,
  "merge_reason": null,
  "workset_itc_ids": [],
  "itc_evidence": null,
  "red_receipt": null,
  "green_receipt": null
}
