{
  "atomic_unit_id": "AU-DU12-01",
  "workset_id": "WS-S0.1-A",
  "title": "set（store.py）",
  "status": "planned",
  "api_ids": [
    "API-DU12-01"
  ],
  "clause_ids": [
    "API-DU12-01-POST-01",
    "API-DU12-01-POST-02",
    "API-DU12-01-PRE-01",
    "API-DU12-01-PRE-02",
    "API-DU12-01-PRE-03",
    "API-DU12-01-RAISE-01",
    "API-DU12-01-RAISE-02"
  ],
  "implementation_unit_ids": [
    "IU-CONFIGSTORE-02"
  ],
  "ut_nodeids": [
    "tests/unit/test_config_store.py::test_direct_update_delete_blocked_by_trigger",
    "tests/unit/test_config_store.py::test_set_inserts_new_row_with_supersedes_chain",
    "tests/unit/test_config_store.py::test_set_same_key_same_changed_at_rejected",
    "tests/unit/test_config_store.py::test_set_without_reason_rejected"
  ],
  "modules": [
    "src/helix/config/store.py"
  ],
  "depends_on_atomic_units": [],
  "coverage_floor": 80,
  "merge_reason": null,
  "workset_itc_ids": [],
  "itc_evidence": null,
  "red_receipt": null,
  "green_receipt": null
}
