{
  "atomic_unit_id": "AU-DU02-08",
  "workset_id": "WS-S0.1-C",
  "title": "generate_tactical_learning_packet（orchestrator.py）",
  "status": "planned",
  "api_ids": [
    "API-DU02-08"
  ],
  "clause_ids": [
    "API-DU02-08-POST-01",
    "API-DU02-08-POST-02",
    "API-DU02-08-PRE-01",
    "API-DU02-08-PRE-02",
    "API-DU02-08-RAISE-01",
    "API-DU02-08-RAISE-02"
  ],
  "implementation_unit_ids": [
    "IU-TLP-01"
  ],
  "ut_nodeids": [
    "tests/unit/test_kernel_orchestrator.py::test_generate_tlp_atomic_with_terminal_transition",
    "tests/unit/test_kernel_orchestrator.py::test_generate_tlp_brief_digest_mismatch_rejected",
    "tests/unit/test_kernel_orchestrator.py::test_generate_tlp_kind_branches_learning_and_failure",
    "tests/unit/test_kernel_orchestrator.py::test_generate_tlp_non_lower_or_nonterminal_rejected"
  ],
  "modules": [
    "src/helix/kernel/orchestrator.py"
  ],
  "depends_on_atomic_units": [
    "AU-DU01-02",
    "AU-DU04-01",
    "AU-DU04-02",
    "AU-DU08-01",
    "AU-DU09-01",
    "AU-DU10-01",
    "AU-DU12-02"
  ],
  "coverage_floor": 80,
  "merge_reason": null,
  "workset_itc_ids": [],
  "itc_evidence": null,
  "red_receipt": null,
  "green_receipt": null
}
