{
  "atomic_unit_id": "AU-DU02-05",
  "workset_id": "WS-S0.1-C",
  "title": "issue_strategic_brief（orchestrator.py）",
  "status": "planned",
  "api_ids": [
    "API-DU02-05"
  ],
  "clause_ids": [
    "API-DU02-05-POST-01",
    "API-DU02-05-POST-02",
    "API-DU02-05-PRE-01",
    "API-DU02-05-PRE-02",
    "API-DU02-05-RAISE-01"
  ],
  "implementation_unit_ids": [
    "IU-STRATEGICBRIEF-02"
  ],
  "ut_nodeids": [
    "tests/unit/test_kernel_orchestrator.py::test_downstream_paths_cannot_write_strategic_briefs",
    "tests/unit/test_kernel_orchestrator.py::test_issue_strategic_brief_digest_deterministic_for_equivalent_json",
    "tests/unit/test_kernel_orchestrator.py::test_issue_strategic_brief_schema_violation_rejected"
  ],
  "modules": [
    "src/helix/kernel/orchestrator.py"
  ],
  "depends_on_atomic_units": [
    "AU-DU01-02",
    "AU-DU04-01",
    "AU-DU04-02",
    "AU-DU08-01",
    "AU-DU09-01",
    "AU-DU10-01",
    "AU-DU12-02"
  ],
  "coverage_floor": 80,
  "merge_reason": null,
  "workset_itc_ids": [],
  "itc_evidence": null,
  "red_receipt": null,
  "green_receipt": null
}
