{
  "atomic_unit_id": "AU-DU07-01",
  "workset_id": "WS-S0.1-B",
  "title": "check_metric_type（zero_ad.py）",
  "status": "planned",
  "api_ids": [
    "API-DU07-01"
  ],
  "clause_ids": [
    "API-DU07-01-POST-01",
    "API-DU07-01-POST-02",
    "API-DU07-01-PRE-01",
    "API-DU07-01-RAISE-01"
  ],
  "implementation_unit_ids": [
    "IU-KPIHANDOFF-02"
  ],
  "ut_nodeids": [
    "tests/unit/test_gates_zero_ad.py::test_check_metric_type_case_variant_rejected",
    "tests/unit/test_gates_zero_ad.py::test_check_metric_type_deny_types_rejected",
    "tests/unit/test_gates_zero_ad.py::test_check_metric_type_free_metric_passes"
  ],
  "modules": [
    "src/helix/gates/zero_ad.py"
  ],
  "depends_on_atomic_units": [],
  "coverage_floor": 80,
  "merge_reason": null,
  "workset_itc_ids": [],
  "itc_evidence": null,
  "red_receipt": null,
  "green_receipt": null
}
